<?xml version="1.0" encoding="UTF-8"?>
<rule xmlns:xsi="http://www.w3.org/2001/XMLSchema-instance" xsi:noNamespaceSchemaLocation="file:///E:/Programming/Documentation/TypiconOnline.Documentation/XML/Rules/RulesModSchema.xsd">
	<switch>
		<expression>
			<daysfromeaster>
				<date>--03-25</date>
			</daysfromeaster>
		</expression>
		<case>
			<values>
				<int>-43</int>
			</values>
			<action>
				<modifyday daymove="-3" priority="5"/>
			</action>
		</case>
	</switch>
</rule>
