<?xml version="1.0" encoding="UTF-8"?>
<rule xmlns:xsi="http://www.w3.org/2001/XMLSchema-instance" xsi:noNamespaceSchemaLocation="file:///E:/Programming/Documentation/TypiconOnline.Documentation/XML/Rules/RulesModSchema.xsd">
	<switch>
		<expression>
			<getclosestday dayofweek="суббота" weekcount="-1">
				<date>--11-08</date>
			</getclosestday>
		</expression>
		<case>
			<values>
				<date>--11-04</date>
			</values>
			<action>
				<modifyday asaddition="true">
					<getclosestday dayofweek="суббота" weekcount="-2">
						<date>--11-08</date>
					</getclosestday>
				</modifyday>
			</action>
		</case>
		<default>
			<modifyday asaddition="true">
				<getclosestday dayofweek="суббота" weekcount="-1">
					<date>--11-08</date>
				</getclosestday>
			</modifyday>
		</default>
	</switch>
</rule>
